{
  "id": "rs_0185d34e8619674f3cdebf6b53ee9e5b",
  "generated_at": "2026-11-01T13:37:50.557Z",
  "family": "secrets",
  "dialect": "ogr-re-1",
  "rules": [
    {
      "id": "entity_private_key",
      "category": "security.secret_leak.private_key",
      "severity": "critical",
      "tier": "strong",
      "flags": "",
      "patterns": [
        {
          "id": "pem_block",
          "source": "-----BEGIN (?:[A-Z0-9]+ )?PRIVATE KEY(?: BLOCK)?-----[A-Za-z0-9+/=\\s\\\\:,.-]*?-----END (?:[A-Z0-9]+ )?PRIVATE KEY(?: BLOCK)?-----"
        },
        {
          "id": "pem_header",
          "source": "-----BEGIN (?:[A-Z0-9]+ )?PRIVATE KEY(?: BLOCK)?-----(?:[\\r\\n]|\\\\[rn]){1,4}[A-Za-z0-9+/]{4,}"
        }
      ],
      "examples": {
        "match": [],
        "nomatch": [
          "-----BEGIN CERTIFICATE-----",
          "-----BEGIN PUBLIC KEY-----",
          "fixtures embed a fake `-----BEGIN PRIVATE KEY-----` filler",
          "[]byte(\"-----BEGIN ENCRYPTED PRIVATE KEY-----\\n\" + b64 + \"\\n-----END ENCRYPTED PRIVATE KEY-----\\n\")"
        ]
      }
    },
    {
      "id": "entity_aws_key_id",
      "category": "security.secret_leak.cloud_credential",
      "severity": "critical",
      "tier": "strong",
      "flags": "",
      "patterns": [
        {
          "id": "aws_access_key_id",
          "source": "(?<![A-Z0-9])(?:AKIA|ASIA|AGPA|AIDA|AROA|ANPA|ANVA|AIPA)[A-Z0-9]{16}(?![A-Z0-9])"
        },
        {
          "id": "tencent_secret_id",
          "source": "(?<![A-Za-z0-9])AKID[A-Za-z0-9]{32}(?![A-Za-z0-9])"
        },
        {
          "id": "aliyun_access_key_id",
          "source": "(?<![A-Za-z0-9])LTAI[A-Za-z0-9]{12,20}(?![A-Za-z0-9])"
        },
        {
          "id": "volcengine_access_key_id",
          "source": "(?<![A-Za-z0-9])AKLT[A-Za-z0-9_\\-]{16,}(?![A-Za-z0-9_\\-])"
        }
      ],
      "examples": {
        "match": [
          "key AROAJ6WCMLZ3PQ4G7DYX in",
          "AKLTZjRhNWQ2ZTctYmM4Mi00"
        ],
        "nomatch": [
          "akiaiosfodnn7example",
          "AKIA1234",
          "XAKIAIOSFODNN7EXAMPLE",
          "AKID1234",
          "LTAI12"
        ]
      }
    },
    {
      "id": "entity_api_key",
      "category": "security.secret_leak.api_key",
      "severity": "critical",
      "tier": "strong",
      "flags": "",
      "patterns": [
        {
          "id": "openai",
          "source": "(?<![A-Za-z0-9])sk-(?:proj-)?[A-Za-z0-9_\\-]{20,}(?![A-Za-z0-9])"
        },
        {
          "id": "anthropic",
          "source": "(?<![A-Za-z0-9])sk-ant-[A-Za-z0-9_\\-]{20,}(?![A-Za-z0-9])"
        },
        {
          "id": "github",
          "source": "(?<![A-Za-z0-9])gh[pousr]_[A-Za-z0-9]{36}(?![A-Za-z0-9])"
        },
        {
          "id": "github_fine_grained",
          "source": "(?<![A-Za-z0-9])github_pat_[A-Za-z0-9_]{40,}(?![A-Za-z0-9])"
        },
        {
          "id": "gitlab",
          "source": "(?<![A-Za-z0-9])gl(?:pat|oas|dt|rtr|rt|cbt|ptt|ft|imt|agent|soat|ffct|wt)-[A-Za-z0-9_.\\-]{20,}(?![A-Za-z0-9_.\\-])"
        },
        {
          "id": "gitlab_runner_legacy",
          "source": "(?<![A-Za-z0-9])GR1348941[A-Za-z0-9_\\-]{20,}(?![A-Za-z0-9_\\-])"
        },
        {
          "id": "slack",
          "source": "(?<![A-Za-z0-9])xox[baprse]-[A-Za-z0-9\\-]{10,}(?![A-Za-z0-9])"
        },
        {
          "id": "slack_app",
          "source": "(?<![A-Za-z0-9])xapp-[0-9]+-[A-Za-z0-9\\-]{10,}(?![A-Za-z0-9])"
        },
        {
          "id": "google",
          "source": "(?<![A-Za-z0-9])AIza[A-Za-z0-9_\\-]{35}(?![A-Za-z0-9])"
        },
        {
          "id": "stripe_secret",
          "source": "(?<![A-Za-z0-9])(?:sk|rk)_(?:live|test)_[A-Za-z0-9]{20,}(?![A-Za-z0-9])"
        },
        {
          "id": "alpaca",
          "source": "(?<![A-Za-z0-9])(?:PK[A-Z0-9]{18}|AK[A-HJ-Z0-9][A-Z0-9]{17}|AKI[B-Z0-9][A-Z0-9]{16})(?![A-Za-z0-9])"
        },
        {
          "id": "sendgrid",
          "source": "(?<![A-Za-z0-9])SG\\.[A-Za-z0-9_\\-]{16,}\\.[A-Za-z0-9_\\-]{16,}(?![A-Za-z0-9])"
        },
        {
          "id": "huggingface",
          "source": "(?<![A-Za-z0-9])hf_[A-Za-z0-9]{30,}(?![A-Za-z0-9])"
        },
        {
          "id": "replicate",
          "source": "(?<![A-Za-z0-9])r8_[A-Za-z0-9]{30,}(?![A-Za-z0-9])"
        },
        {
          "id": "npm",
          "source": "(?<![A-Za-z0-9])npm_[A-Za-z0-9]{30,}(?![A-Za-z0-9])"
        },
        {
          "id": "pypi",
          "source": "(?<![A-Za-z0-9])pypi-[A-Za-z0-9_\\-]{30,}(?![A-Za-z0-9])"
        },
        {
          "id": "digitalocean",
          "source": "(?<![A-Za-z0-9])do[po]_v1_[A-Za-z0-9]{32,}(?![A-Za-z0-9])"
        },
        {
          "id": "groq",
          "source": "(?<![A-Za-z0-9])gsk_[A-Za-z0-9]{30,}(?![A-Za-z0-9])"
        },
        {
          "id": "xai",
          "source": "(?<![A-Za-z0-9])xai-[A-Za-z0-9]{30,}(?![A-Za-z0-9])"
        },
        {
          "id": "perplexity",
          "source": "(?<![A-Za-z0-9])pplx-[A-Za-z0-9]{30,}(?![A-Za-z0-9])"
        },
        {
          "id": "fireworks",
          "source": "(?<![A-Za-z0-9])(?:fw[-_]|fpk_)[A-Za-z0-9]{30,}(?![A-Za-z0-9])"
        },
        {
          "id": "notion",
          "source": "(?<![A-Za-z0-9])ntn_[A-Za-z0-9]{30,}(?![A-Za-z0-9])"
        },
        {
          "id": "tavily",
          "source": "(?<![A-Za-z0-9])tvly-[A-Za-z0-9_\\-]{20,}(?![A-Za-z0-9])"
        },
        {
          "id": "fal",
          "source": "(?<![A-Za-z0-9])fal_[A-Za-z0-9_\\-]{20,}(?![A-Za-z0-9])"
        },
        {
          "id": "firecrawl",
          "source": "(?<![A-Za-z0-9])fc-[A-Za-z0-9]{20,}(?![A-Za-z0-9])"
        },
        {
          "id": "browserbase",
          "source": "(?<![A-Za-z0-9])bb_live_[A-Za-z0-9_\\-]{20,}(?![A-Za-z0-9])"
        },
        {
          "id": "langfuse",
          "source": "(?<![A-Za-z0-9])(?:pk|sk)-lf-[a-f0-9\\-]{30,}(?![A-Za-z0-9])"
        },
        {
          "id": "elevenlabs",
          "source": "(?<![A-Za-z0-9])sk_[a-f0-9]{40,}(?![A-Za-z0-9])"
        },
        {
          "id": "vendor_prefixed",
          "source": "(?<![A-Za-z0-9])(?:am|retaindb|mem0|brv|syt|exa)_[A-Za-z0-9_\\-]{16,}(?![A-Za-z0-9])"
        },
        {
          "id": "hindsight",
          "source": "(?<![A-Za-z0-9])hsk-[A-Za-z0-9]{16,}(?![A-Za-z0-9])"
        },
        {
          "id": "fernet",
          "source": "(?<![A-Za-z0-9])gAAAA[A-Za-z0-9_=\\-]{40,}(?![A-Za-z0-9])"
        },
        {
          "id": "telegram_bot",
          "source": "(?<![A-Za-z0-9])[0-9]{8,10}:[A-Za-z0-9_\\-]{35}(?![A-Za-z0-9_\\-])"
        },
        {
          "id": "vault",
          "source": "(?<![A-Za-z0-9])hv[sbr]\\.[A-Za-z0-9_\\-]{24,}(?![A-Za-z0-9_\\-])"
        },
        {
          "id": "jwt",
          "source": "(?<![A-Za-z0-9_\\-])ey[A-Za-z0-9_\\-]{8,}\\.[A-Za-z0-9_\\-]{8,}\\.[A-Za-z0-9_\\-]{8,}(?![A-Za-z0-9_\\-])"
        }
      ],
      "reject_value": [
        {
          "predicate": {
            "kind": "matches",
            "pattern": "^[a-z]+(?:[_\\-]+[a-z]+){2,}$"
          }
        }
      ],
      "examples": {
        "match": [
          "123456789:AAFZx8Q1pLm9aQvR2tYwB7nK4sDabcdefgh",
          "VAULT_TOKEN=hvs.CAESIJ3kQ9fX2mN8pL4rT6vW0yA1bC3dE5fG7hI9jK",
          "PKZ8Q1PLM9AQVR2TYWB7",
          "APCA_API_KEY_ID=AK7Q1PLM9AQVR2TYWB7N"
        ],
        "nomatch": [
          "sk-${OPENAI_API_KEY}",
          "ghp_short",
          "sk-...3ab",
          "pk_live_abcdefghijklmnopqrstuvwxyz",
          "sk-ant-x",
          "AKIAIOSFODNN7EXAMPLE",
          "PKG_VERSION_2026_09_09"
        ]
      }
    },
    {
      "id": "entity_bearer_token",
      "category": "security.secret_leak.api_key",
      "severity": "critical",
      "tier": "strong",
      "flags": "i",
      "patterns": [
        {
          "id": "authorization_header",
          "source": "(?<![A-Za-z0-9\\-])(?:proxy-)?authorization\\s*:\\s*(?:bearer|basic|token|apikey)\\s{1,4}(?!(?:\\*{3,}|x{3,}|\\$\\{|OGRK[0-9A-Z][0-9X]{7,}|<|>|%[sd]|\\.{3,}|…|changeme|placeholder|redacted|your[_\\-]?password|your[_\\-]|example|token(?![A-Za-z0-9_])|secret(?![A-Za-z0-9_])|\\$))(?![A-Za-z0-9._~+/\\-]*(?:\\.{3,}|…))([A-Za-z0-9._~+/\\-]{12,}={0,2})"
        }
      ],
      "group": 1,
      "examples": {
        "match": [
          "curl -H \"Authorization: Bearer pk_cc7f7b3f73664638b8f30fe8ca598848\"",
          "Proxy-Authorization: Basic dXNlcjpwYXNzd29yZDEyMw=="
        ],
        "nomatch": [
          "Authorization: Bearer <YOUR_TOKEN>",
          "Authorization: Bearer ${API_TOKEN}",
          "Authorization: Bearer $TOKEN",
          "Authorization: Bearer pk_cc7...8848",
          "Authorization: Bearer xxxxxxxxxxxxxxxx"
        ]
      }
    },
    {
      "id": "entity_api_key_header",
      "category": "security.secret_leak.api_key",
      "severity": "critical",
      "tier": "strong",
      "flags": "i",
      "patterns": [
        {
          "id": "api_key_header",
          "source": "(?<![A-Za-z0-9\\-])(?:x-[a-z0-9]{1,24}(?:-[a-z0-9]{1,24}){0,3}-(?:key|token|secret)|x-api-key|x-goog-api-key|api-key|apikey|x-api-token|x-auth-token|x-access-token|x-amz-security-token|ocp-apim-subscription-key)\\s*:\\s*[\"']?(?!(?:\\*{3,}|x{3,}|\\$\\{|OGRK[0-9A-Z][0-9X]{7,}|<|>|%[sd]|\\.{3,}|…|changeme|placeholder|redacted|your[_\\-]?password|your[_\\-]|example|\\$))([A-Za-z0-9._~+/=\\-]{12,})"
        }
      ],
      "group": 1,
      "reject_value": [
        {
          "predicate": {
            "kind": "placeholder",
            "anywhere": true
          }
        },
        {
          "predicate": {
            "kind": "variable_reference"
          }
        },
        {
          "predicate": {
            "kind": "names_secret"
          }
        },
        {
          "predicate": {
            "kind": "secret_noun"
          }
        }
      ],
      "examples": {
        "match": [
          "X-Api-Key: Zx8Q1pLm9aQvR2tYwB7nK4sD",